{
  "schema_version": "2.3",
  "reuse_result_id": "efru_01J00000000000000000000021",
  "project_id": "efp_01J00000000000000000000001",
  "reference_workflow_occurrence_id": "efw_01J00000000000000000000014",
  "reference_manifest_revision_id": "efm_01J00000000000000000000016",
  "new_input_tree_revision_id": "eft_01J00000000000000000000005",
  "output_workflow_occurrence_id": "efw_01J00000000000000000000014",
  "status": "completed",
  "deviation_summary": "The new project omitted one optional evidence branch.",
  "semantic_leakage_evaluation_ref": "efee_01J00000000000000000000020",
  "equivalence_evaluation_refs": [
    "efee_01J00000000000000000000020"
  ],
  "acceptance_decision_ref": "efsd_01J00000000000000000000012",
  "created_at": "2026-07-15T13:10:00Z"
}
